### ISSUE TITLE
Cuckoo submit sample is not working

### ISSUE THREAD

**Issue by lowwww** [cuckoosandbox/cuckoo#1419]
Hi guys,

Did a fresh install of the latest cuckoo release on my 16.04 lts host (VM). The guest I'm trying to infect is a Win7x64 and the guest can ping the host. When I submit a binary it seems to start up the vm and restore the snapshot, but it won't start analysing. I also tried it with an XP vm, which has exactly the same result. Below is the output when just starting the submit command:      

                           _|
     _|_|_|  _|    _|    _|_|_|  _|  _|      _|_|      _|_|
   _|        _|    _|  _|        _|_|      _|    _|  _|    _|
   _|        _|    _|  _|        _|  _|    _|    _|  _|    _|
     _|_|_|    _|_|_|    _|_|_|  _|    _|    _|_|      _|_|

 Cuckoo Sandbox 2.0.1
 www.cuckoosandbox.org
 Copyright (c) 2010-2017

 Checking for updates...
 You're good to go!
2017-04-16 10:45:42,114 [cuckoo.core.startup] INFO: Updated running task ID 21 status to failed_analysis
2017-04-16 10:45:42,123 [cuckoo.core.startup] WARNING: Unable to import yara (please compile from sources)
2017-04-16 10:45:42,124 [cuckoo.core.scheduler] INFO: Using "virtualbox" as machine manager
2017-04-16 10:45:43,966 [cuckoo.core.scheduler] INFO: Loaded 1 machine/s
2017-04-16 10:45:43,986 [cuckoo.core.scheduler] INFO: Waiting for analysis tasks.
2017-04-16 10:45:49,165 [cuckoo.core.scheduler] INFO: Starting analysis of FILE "Locky.exe" (task #22, options "")
2017-04-16 10:45:49,206 [cuckoo.core.scheduler] INFO: Task #22: acquired machine cuckoo1 (label=cuckoo1)
2017-04-16 10:45:49,219 [cuckoo.auxiliary.sniffer] INFO: Started sniffer with PID 4580 (interface=vboxnet0, host=192.168.56.101, pcap=/home/wick/.cuckoo/storage/analyses/22/dump.pcap)
2017-04-16 10:45:53,003 [cuckoo.core.guest] INFO: Starting analysis on guest (id=cuckoo1, ip=192.168.56.101)
2017-04-16 10:46:02,435 [cuckoo.core.guest] INFO: Guest is running Cuckoo Agent 0.7 (id=cuckoo1, ip=192.168.56.101)

**After waiting for a while I get this:**

2017-04-16 10:52:05,728 [cuckoo.core.scheduler] ERROR: Error from the Cuckoo Guest: The analysis hit the critical timeout, terminating.
2017-04-16 10:52:05,736 [cuckoo.core.plugins] ERROR: Unable to stop auxiliary module: Sniffer
Traceback (most recent call last):
  File "/usr/local/lib/python2.7/dist-packages/cuckoo/core/plugins.py", line 160, in stop
    module.stop()
  File "/usr/local/lib/python2.7/dist-packages/cuckoo/auxiliary/sniffer.py", line 150, in stop
    "to Ubuntu-based distributions with AppArmor)?" % (out, err)
CuckooOperationalError: Error running tcpdump to sniff the network traffic during the analysis; stdout = '' and stderr = 'tcpdump: /home/wick/.cuckoo/storage/analyses/22/dump.pcap: Permission denied\n'. Did you enable the extra capabilities to allow running tcpdump as non-root user and disable AppArmor properly (the latter only applies to Ubuntu-based distributions with AppArmor)?
2017-04-16 10:52:07,115 [cuckoo.processing.behavior] WARNING: Analysis results folder does not exist at path '/home/wick/.cuckoo/storage/analyses/22/logs'.
2017-04-16 10:52:07,530 [cuckoo.processing.network] WARNING: The PCAP file does not exist at path "/home/wick/.cuckoo/storage/analyses/22/dump.pcap".
2017-04-16 10:52:07,530 [cuckoo.processing.debug] ERROR: Error processing task #22: it appears that the Virtual Machine hasn't been able to contact back to the Cuckoo Host. There could be a few reasons for this, please refer to our documentation on the matter: https://cuckoo.sh/docs/faq/index.html#troubleshooting-vm-network-configuration
2017-04-16 10:52:07,567 [cuckoo.core.scheduler] INFO: Task #22: reports generation completed (path=/home/wick/.cuckoo/storage/analyses/22)
2017-04-16 10:52:07,589 [cuckoo.core.scheduler] INFO: Task #22: analysis procedure completed

**Comment by doomedraven** [comment]
try this first 
https://cuckoo.sh/docs/installation/host/requirements.html?highlight=apparmor#installing-tcpdump

**Comment by doomedraven** [comment]
also can you curl agent from host and get response?

**Comment by lowwww** [comment]
When I curl:

wick@ubuntu:~$ curl 192.168.56.101:8000

{"message": "Cuckoo Agent!", "version": "0.7", "features": ["execpy", "pinning", "logs", "largefile", "unicodepath"]}

**Comment by doomedraven** [comment]
hm weird, well check https://cuckoo.sh/docs/faq/index.html#troubleshooting-vm-network-configuration,but first fix the tcpdump part as that can be also related issue, ipointed to that in previous comment

**Comment by lowwww** [comment]
Cool, I will follow the install steps and see if the problems still persists

**Comment by lowwww** [comment]
<img width="1361" alt="screen shot 2017-04-16 at 12 31 20" src="https://cloud.githubusercontent.com/assets/20739562/25070504/a4a9ecd2-22a0-11e7-8ff3-8570af24d082.png">

That is how it stays when submitting. I also retried the tcpdump install using the guide.

**Comment by doomedraven** [comment]
so it works now?

**Comment by lowwww** [comment]
Nope, it still gives an error. I also don't see that the file I'm submitting is actually pushed too the guest Win7 VM. 

<img width="1369" alt="screen shot 2017-04-16 at 12 37 15" src="https://cloud.githubusercontent.com/assets/20739562/25070534/79d8be06-22a1-11e7-9e8d-a27575be3a34.png">

**Comment by doomedraven** [comment]
well as error says it can't contact back to host,check vm ip virtualbox.conf and cuckoo listener ip in cuckoo.conf, and check if you have firewall on host as it may cut incomming connections or firewall inside of the vm

**Comment by lowwww** [comment]
Will go troubleshooting on that point. I'm out for now, but will get back to you later. Thanks so far!

**Comment by doomedraven** [comment]
you are welcome, when you push sample to cuckoo start tcpdump listener to see if host receives connections back from guest, if no that may be due to firewalls or wrong configuration

**Comment by FoxyNPF** [comment]
@lowwww 

Did you have any joy sorting this issue?

**Comment by FoxyNPF** [comment]
Hi, I get the eact same output of curl 192.168.56.101:8000.

I've run TCP dump while submitting a file. Here is a sample of the output from listening on vboxnet0:

14:51:18.836056 IP 192.168.56.101.8000 > 192.168.56.1.38550: Flags [.], ack 3453481, win 62, options [nop,nop,TS val 26241 ecr 5161865], length 0
14:51:18.836247 IP 192.168.56.101.8000 > 192.168.56.1.38550: Flags [.], ack 3467961, win 5, options [nop,nop,TS val 26241 ecr 5161865], length 0
14:51:18.837550 IP 192.168.56.101.8000 > 192.168.56.1.38550: Flags [.], ack 3467961, win 22, options [nop,nop,TS val 26241 ecr 5161865], length 0
14:51:18.837566 IP 192.168.56.1.38550 > 192.168.56.101.8000: Flags [.], seq 3467961:3469409, ack 1, win 229, options [nop,nop,TS val 5161866 ecr 26241], length 1448
14:51:18.837581 IP 192.168.56.1.38550 > 192.168.56.101.8000: Flags [P.], seq 3469409:3470857, ack 1, win 229, options [nop,nop,TS val 5161866 ecr 26241], length 1448
14:51:18.837585 IP 192.168.56.1.38550 > 192.168.56.101.8000: Flags [.], seq 3470857:3472305, ack 1, win 229, options [nop,nop,TS val 5161866 ecr 26241], length 1448
14:51:18.838516 IP 192.168.56.101.8000 > 192.168.56.1.38550: Flags [.], ack 3472305, win 5, options [nop,nop,TS val 26242 ecr 5161866], length 0
14:51:18.838990 IP 192.168.56.101.8000 > 192.168.56.1.38550: Flags [.], ack 3472305, win 243, options [nop,nop,TS val 26242 ecr 5161866], length 0
14:51:18.839003 IP 192.168.56.1.38550 > 192.168.56.101.8000: Flags [.], seq 3472305:3473753, ack 1, win 229, options [nop,nop,TS val 5161866 ecr 26242], length 1448
14:51:18.839017 IP 192.168.56.1.38550 > 192.168.56.101.8000: Flags [.], seq 3473753:3475201, ack 1, win 229, options [nop,nop,TS val 5161866 ecr 26242], length 1448
14:51:18.839021 IP 192.168.56.1.38550 > 192.168.56.101.8000: Flags [.], seq 3475201:3476649, ack 1, win 229, options [nop,nop,TS val 5161866 ecr 26242], length 1448
14:51:18.839025 IP 192.168.56.1.38550 > 192.168.56.101.8000: Flags [.], seq 3476649:3478097, ack 1, win 229, options [nop,nop,TS val 5161866 ecr 26242], length 1448
 

I'm guessing packet 'length 0' from VM to the host indicates a config issue?

**Comment by jbremer** [comment]
@FoxyNPF `length 0` are simply TCP/IP packets without any data in there. E.g., `SYN`/`ACK` packets etc.
@lowwww @FoxyNPF Did you properly fill out the IP addresses etc in the configuration?

**Comment by FoxyNPF** [comment]
Hi,

Heres some screen shots of what i have configured:

![1](https://cloud.githubusercontent.com/assets/26876090/25185214/ada204e8-2514-11e7-9f19-ac751c673758.PNG)
![2](https://cloud.githubusercontent.com/assets/26876090/25185219/b2c3dc3a-2514-11e7-9136-1818660e3eb3.PNG)
![3](https://cloud.githubusercontent.com/assets/26876090/25185225/b6fc578c-2514-11e7-955b-29cf3c17fe3e.PNG)
![4](https://cloud.githubusercontent.com/assets/26876090/25185229/b9787ef0-2514-11e7-8eac-eb18e9e5826d.PNG)

**Comment by jbremer** [comment]
@lowwww @FoxyNPF Thanks for the feedback - it is indeed correct that Windows XP analysis was broken. In the meanwhile we've put out a new alpha release which fixes these issues (as well as introduces migration code for the CWD, because the files that have to be updated for this fix include those in `$CWD/analyzer/windows/`).
Assuming you haven't made any out of the ordinary changes in your CWD you'll be able to install the latest version of Cuckoo and Cuckoo will automatically upgrade your CWD to the latest version the next time you run it. If an automatic upgrade isn't possible, Cuckoo will inform you on steps forward.
You may upgrade with `pip install cuckoo==2.0.3a2` for now, until we release a stable release.
Please let me know if these instructions are enough to upgrade your version of Cuckoo & if they resolve your Windows XP analyses.
Thanks again! If you have any additional questions, do not hesitate to let us know :-)

**Comment by jbremer** [comment]
Didn't receive any feedback, so going to assume all went well. Closing issue.
Feel free to reopen or create a new issue if additional questions & feedback pop up!

**Comment by anushthakalia** [comment]
Hey
Even after upgrading to  2.0.3a2 I'm receiving the following error:
`[cuckoo.processing.debug] ERROR: Error processing task #11: it appears that the Virtual Machine hasn't been able to contact back to the Cuckoo Host. There could be a few reasons for this, please refer to our documentation on the matter: https://cuckoo.sh/docs/faq/index.html#troubleshooting-vm-network-configuration`
I have ubuntu 15.04 as host and windows xp as guest
