### ISSUE TITLE
Error from the Cuckoo Guest: The analysis hit the critical timeout, terminating.

### ISSUE THREAD

**Issue by goldbear564** [cuckoosandbox/cuckoo#1618]
i install cuckoo in my desktop(ubuntu14.04)
and when i analyze in cuckoo web server it seems working on.
after analyze some files, in summary, i always see err all times.

after that, when i analyzed files and tcpdump(interface:vboxnet0) i can see packets like this
14:33:17.283236 IP 192.168.56.1.52852 > 192.168.56.101.8000: Flags [.], ack 54, win 229, options [nop,nop,TS val 32875619 ecr 40455], length 0
14:33:17.283447 IP 192.168.56.101.8000 > 192.168.56.1.52852: Flags [P.], seq 54:91, ack 157, win 260, options [nop,nop,TS val 40455 ecr 32875619], length 37
14:33:17.283473 IP 192.168.56.1.52852 > 192.168.56.101.8000: Flags [.], ack 91, win 229, options [nop,nop,TS val 32875619 ecr 40455], length 0
14:33:17.283705 IP 192.168.56.101.8000 > 192.168.56.1.52852: Flags [FP.], seq 91:160, ack 157, win 260, options [nop,nop,TS val 40455 ecr 32875619], length 69
14:33:17.284485 IP 192.168.56.1.52852 > 192.168.56.101.8000: Flags [F.], seq 157, ack 161, win 229, options [nop,nop,TS val 32875619 ecr 40455], length 0
14:33:17.284721 IP 192.168.56.101.8000 > 192.168.56.1.52852: Flags [.], ack 158, win 260, options [nop,nop,TS val 40456 ecr 32875619], length 0
14:33:18.291639 IP 192.168.56.1.52856 > 192.168.56.101.8000: Flags [S], seq 3202414797, win 29200, options [mss 1460,sackOK,TS val 32875871 ecr 0,nop,wscale 7], length 0
14:33:18.291973 IP 192.168.56.101.8000 > 192.168.56.1.52856: Flags [S.], seq 43290278, ack 3202414798, win 8192, options [mss 1460,nop,wscale 8,sackOK,TS val 40556 ecr 32875871], length 0

it seems works very fine. but it ends with always like this
14:33:22.948524 IP 192.168.56.1.2042 > 192.168.56.101.49160: Flags [F.], seq 0, ack 1, win 229, length 0
14:33:24.552543 IP 192.168.56.1.2042 > 192.168.56.101.49160: Flags [F.], seq 0, ack 1, win 229, length 0
14:33:27.764541 IP 192.168.56.1.2042 > 192.168.56.101.49160: Flags [F.], seq 0, ack 1, win 229, length 0
14:33:34.180540 IP 192.168.56.1.2042 > 192.168.56.101.49160: Flags [F.], seq 0, ack 1, win 229, length 0
14:33:47.028571 IP 192.168.56.1.2042 > 192.168.56.101.49160: Flags [F.], seq 0, ack 1, win 229, length 0
14:34:12.692562 IP 192.168.56.1.2042 > 192.168.56.101.49160: Flags [F.], seq 0, ack 1, win 229, length 0

so can you guys tell me what is wrong with my cuckoo?

ps. sorry about my english
