### ISSUE TITLE
cuckoo.processing.behavior] WARNING: Analysis results folder does not exist at path '/home/cuckoo/.cuckoo/storage/analyses/1/logs'.

### ISSUE THREAD

**Issue by easyboy72** [cuckoosandbox/cuckoo#1979]
Thanks in advance for your assistance. I am having two problem with my cuckoo sandbox new installation. Analyzer log is empty when I check the cuckoo gui interface. Note: I installed cuckoo in a virtual environment. (venv) cuckoo@cuckoo-virtbox:~$

**cuckoo.log**
2017-11-23 21:25:58,941 [cuckoo.core.scheduler] INFO: Task #1: acquired machine win7cuckoo (label=win7cuckoo)
2017-11-23 21:25:58,948 [cuckoo.auxiliary.sniffer] INFO: Started sniffer with PID 3815 (interface=vboxnet0, host=192.168.56.10)
2017-11-23 21:25:58,951 [cuckoo.core.plugins] DEBUG: Started auxiliary module: Sniffer
2017-11-23 21:25:58,988 [cuckoo.machinery.virtualbox] DEBUG: Starting vm win7cuckoo
2017-11-23 21:25:59,109 [cuckoo.machinery.virtualbox] DEBUG: Restoring virtual machine win7cuckoo to snapshot2
2017-11-23 21:26:05,470 [cuckoo.core.guest] INFO: Starting analysis on guest (id=win7cuckoo, ip=192.168.56.10)
2017-11-23 21:26:06,476 [cuckoo.core.guest] DEBUG: win7cuckoo: not ready yet
2017-11-23 21:26:07,480 [cuckoo.core.guest] DEBUG: win7cuckoo: not ready yet
2017-11-23 21:26:08,483 [cuckoo.core.guest] DEBUG: win7cuckoo: not ready yet
2017-11-23 21:26:08,555 [cuckoo.core.guest] DEBUG: win7cuckoo: not ready yet
2017-11-23 21:26:09,567 [cuckoo.core.guest] INFO: Guest is running Cuckoo Agent 0.8 (id=win7cuckoo, ip=192.168.56.10)
2017-11-23 21:26:09,687 [cuckoo.core.guest] DEBUG: Uploading analyzer to guest (id=win7cuckoo, ip=192.168.56.10, monitor=latest, size=3842483)
2017-11-23 21:26:10,542 [cuckoo.core.guest] DEBUG: win7cuckoo: analysis still processing
2017-11-23 21:26:11,721 [cuckoo.core.guest] DEBUG: win7cuckoo: analysis still processing
2017-11-23 21:26:12,734 [cuckoo.core.guest] DEBUG: win7cuckoo: analysis still processing
2017-11-23 21:26:13,750 [cuckoo.core.guest] DEBUG: win7cuckoo: analysis still processing
2017-11-23 21:26:14,757 [cuckoo.core.guest] DEBUG: win7cuckoo: analysis still processing
2017-11-23 21:26:15,764 [cuckoo.core.guest] DEBUG: win7cuckoo: analysis still processing
2017-11-23 21:26:16,777 [cuckoo.core.guest] DEBUG: win7cuckoo: analysis still processing
2017-11-23 21:26:17,810 [cuckoo.core.guest] DEBUG: win7cuckoo: analysis still processing
2017-11-23 21:26:18,816 [cuckoo.core.guest] DEBUG: win7cuckoo: analysis still processing
2017-11-23 21:26:19,827 [cuckoo.core.guest] DEBUG: win7cuckoo: analysis still processing
2017-11-23 21:26:20,834 [cuckoo.core.guest] DEBUG: win7cuckoo: analysis still processing
2017-11-23 21:26:21,842 [cuckoo.core.guest] DEBUG: win7cuckoo: analysis still processing
2017-11-23 21:26:22,849 [cuckoo.core.guest] DEBUG: win7cuckoo: analysis still processing
2017-11-23 21:26:23,855 [cuckoo.core.guest] DEBUG: win7cuckoo: analysis still processing
2017-11-23 21:26:24,862 [cuckoo.core.guest] DEBUG: win7cuckoo: analysis still processing
2017-11-23 21:26:25,868 [cuckoo.core.guest] DEBUG: win7cuckoo: analysis still processing
2017-11-23 21:26:26,876 [cuckoo.core.guest] DEBUG: win7cuckoo: analysis still processing
2017-11-23 21:26:27,883 [cuckoo.core.guest] DEBUG: win7cuckoo: analysis still processing
2017-11-23 21:26:28,889 [cuckoo.core.guest] DEBUG: win7cuckoo: analysis still processing
2017-11-23 21:26:29,896 [cuckoo.core.guest] DEBUG: win7cuckoo: analysis still processing
2017-11-23 21:26:30,905 [cuckoo.core.guest] DEBUG: win7cuckoo: analysis still processing
2017-11-23 21:26:31,912 [cuckoo.core.guest] DEBUG: win7cuckoo: analysis still processing
2017-11-23 21:26:32,919 [cuckoo.core.guest] DEBUG: win7cuckoo: analysis still processing
2017-11-23 21:26:33,924 [cuckoo.core.guest] DEBUG: win7cuckoo: analysis still processing
2017-11-23 21:26:34,929 [cuckoo.core.guest] DEBUG: win7cuckoo: analysis still processing
2017-11-23 21:26:35,933 [cuckoo.core.guest] DEBUG: win7cuckoo: analysis still processing
2017-11-23 21:26:36,939 [cuckoo.core.guest] DEBUG: win7cuckoo: analysis still processing
2017-11-23 21:26:37,944 [cuckoo.core.guest] DEBUG: win7cuckoo: analysis still processing
2017-11-23 21:26:38,950 [cuckoo.core.guest] DEBUG: win7cuckoo: analysis still processing
2017-11-23 21:26:39,956 [cuckoo.core.guest] DEBUG: win7cuckoo: analysis still processing
2017-11-23 21:26:40,962 [cuckoo.core.guest] DEBUG: win7cuckoo: analysis still processing
2017-11-23 21:26:41,967 [cuckoo.core.guest] DEBUG: win7cuckoo: analysis still processing
2017-11-23 21:26:42,973 [cuckoo.core.guest] DEBUG: win7cuckoo: analysis still processing
2017-11-23 21:26:43,980 [cuckoo.core.guest] DEBUG: win7cuckoo: analysis still processing
2017-11-23 21:26:44,986 [cuckoo.core.guest] DEBUG: win7cuckoo: analysis still processing
2017-11-23 21:26:45,992 [cuckoo.core.guest] DEBUG: win7cuckoo: analysis still processing
2017-11-23 21:26:47,004 [cuckoo.core.guest] DEBUG: win7cuckoo: analysis still processing
2017-11-23 21:26:48,010 [cuckoo.core.guest] DEBUG: win7cuckoo: analysis still processing
2017-11-23 21:26:49,018 [cuckoo.core.guest] DEBUG: win7cuckoo: analysis still processing
2017-11-23 21:26:50,026 [cuckoo.core.guest] DEBUG: win7cuckoo: analysis still processing
2017-11-23 21:26:51,032 [cuckoo.core.guest] DEBUG: win7cuckoo: analysis still processing
2017-11-23 21:26:52,040 [cuckoo.core.guest] DEBUG: win7cuckoo: analysis still processing
2017-11-23 21:26:53,046 [cuckoo.core.guest] DEBUG: win7cuckoo: analysis still processing
2017-11-23 21:26:54,052 [cuckoo.core.guest] DEBUG: win7cuckoo: analysis still processing
2017-11-23 21:26:55,059 [cuckoo.core.guest] DEBUG: win7cuckoo: analysis still processing
2017-11-23 21:26:56,065 [cuckoo.core.guest] DEBUG: win7cuckoo: analysis still processing
2017-11-23 21:26:57,073 [cuckoo.core.guest] DEBUG: win7cuckoo: analysis still processing
2017-11-23 21:26:58,084 [cuckoo.core.guest] DEBUG: win7cuckoo: analysis still processing
2017-11-23 21:26:59,092 [cuckoo.core.guest] DEBUG: win7cuckoo: analysis still processing
2017-11-23 21:27:00,098 [cuckoo.core.guest] DEBUG: win7cuckoo: analysis still processing
2017-11-23 21:27:01,104 [cuckoo.core.guest] DEBUG: win7cuckoo: analysis still processing
2017-11-23 21:27:02,117 [cuckoo.core.guest] DEBUG: win7cuckoo: analysis still processing
2017-11-23 21:27:03,124 [cuckoo.core.guest] DEBUG: win7cuckoo: analysis still processing
2017-11-23 21:27:04,130 [cuckoo.core.guest] DEBUG: win7cuckoo: analysis still processing
2017-11-23 21:27:05,137 [cuckoo.core.guest] DEBUG: win7cuckoo: analysis still processing
2017-11-23 21:27:06,143 [cuckoo.core.guest] DEBUG: win7cuckoo: analysis still processing
2017-11-23 21:27:07,151 [cuckoo.core.guest] DEBUG: win7cuckoo: analysis still processing
2017-11-23 21:27:08,157 [cuckoo.core.guest] DEBUG: win7cuckoo: analysis still processing
2017-11-23 21:27:09,164 [cuckoo.core.guest] DEBUG: win7cuckoo: analysis still processing
2017-11-23 21:27:10,170 [cuckoo.core.guest] DEBUG: win7cuckoo: analysis still processing
2017-11-23 21:27:11,176 [cuckoo.core.guest] DEBUG: win7cuckoo: analysis still processing
2017-11-23 21:27:12,184 [cuckoo.core.guest] DEBUG: win7cuckoo: analysis still processing
2017-11-23 21:27:13,193 [cuckoo.core.guest] DEBUG: win7cuckoo: analysis still processing
2017-11-23 21:27:14,199 [cuckoo.core.guest] DEBUG: win7cuckoo: analysis still processing
2017-11-23 21:27:15,207 [cuckoo.core.guest] DEBUG: win7cuckoo: analysis still processing
2017-11-23 21:27:16,217 [cuckoo.core.guest] DEBUG: win7cuckoo: analysis still processing
2017-11-23 21:27:17,225 [cuckoo.core.guest] DEBUG: win7cuckoo: analysis still processing
2017-11-23 21:27:18,234 [cuckoo.core.guest] DEBUG: win7cuckoo: analysis still processing
2017-11-23 21:27:19,239 [cuckoo.core.guest] DEBUG: win7cuckoo: analysis still processing
2017-11-23 21:27:20,245 [cuckoo.core.guest] DEBUG: win7cuckoo: analysis still processing
2017-11-23 21:27:21,250 [cuckoo.core.guest] DEBUG: win7cuckoo: analysis still processing
2017-11-23 21:27:22,258 [cuckoo.core.guest] DEBUG: win7cuckoo: analysis still processing
2017-11-23 21:27:23,264 [cuckoo.core.guest] DEBUG: win7cuckoo: analysis still processing
2017-11-23 21:27:24,270 [cuckoo.core.guest] DEBUG: win7cuckoo: analysis still processing
2017-11-23 21:27:25,281 [cuckoo.core.guest] DEBUG: win7cuckoo: analysis still processing
2017-11-23 21:27:26,292 [cuckoo.core.guest] DEBUG: win7cuckoo: analysis still processing
2017-11-23 21:27:27,300 [cuckoo.core.guest] DEBUG: win7cuckoo: analysis still processing
2017-11-23 21:27:28,307 [cuckoo.core.guest] DEBUG: win7cuckoo: analysis still processing
2017-11-23 21:27:29,312 [cuckoo.core.guest] DEBUG: win7cuckoo: analysis still processing
2017-11-23 21:27:30,319 [cuckoo.core.guest] DEBUG: win7cuckoo: analysis still processing
2017-11-23 21:27:31,327 [cuckoo.core.guest] DEBUG: win7cuckoo: analysis still processing
2017-11-23 21:27:32,335 [cuckoo.core.guest] DEBUG: win7cuckoo: analysis still processing
2017-11-23 21:27:33,341 [cuckoo.core.guest] DEBUG: win7cuckoo: analysis still processing
2017-11-23 21:27:34,349 [cuckoo.core.guest] DEBUG: win7cuckoo: analysis still processing
2017-11-23 21:27:35,357 [cuckoo.core.guest] DEBUG: win7cuckoo: analysis still processing
2017-11-23 21:27:36,364 [cuckoo.core.guest] DEBUG: win7cuckoo: analysis still processing
2017-11-23 21:27:37,373 [cuckoo.core.guest] DEBUG: win7cuckoo: analysis still processing
2017-11-23 21:27:38,380 [cuckoo.core.guest] DEBUG: win7cuckoo: analysis still processing
2017-11-23 21:27:39,388 [cuckoo.core.guest] DEBUG: win7cuckoo: analysis still processing
2017-11-23 21:27:40,398 [cuckoo.core.guest] DEBUG: win7cuckoo: analysis still processing
2017-11-23 21:27:41,405 [cuckoo.core.guest] DEBUG: win7cuckoo: analysis still processing
2017-11-23 21:27:42,412 [cuckoo.core.guest] DEBUG: win7cuckoo: analysis still processing
2017-11-23 21:27:43,419 [cuckoo.core.guest] DEBUG: win7cuckoo: analysis still processing
2017-11-23 21:27:44,424 [cuckoo.core.guest] DEBUG: win7cuckoo: analysis still processing
2017-11-23 21:27:45,430 [cuckoo.core.guest] DEBUG: win7cuckoo: analysis still processing
2017-11-23 21:27:46,436 [cuckoo.core.guest] DEBUG: win7cuckoo: analysis still processing
2017-11-23 21:27:47,446 [cuckoo.core.guest] DEBUG: win7cuckoo: analysis still processing
2017-11-23 21:27:48,452 [cuckoo.core.guest] DEBUG: win7cuckoo: analysis still processing
2017-11-23 21:27:49,457 [cuckoo.core.guest] DEBUG: win7cuckoo: analysis still processing
2017-11-23 21:27:50,463 [cuckoo.core.guest] DEBUG: win7cuckoo: analysis still processing
2017-11-23 21:27:51,470 [cuckoo.core.guest] DEBUG: win7cuckoo: analysis still processing
2017-11-23 21:27:52,477 [cuckoo.core.guest] DEBUG: win7cuckoo: analysis still processing
2017-11-23 21:27:53,483 [cuckoo.core.guest] DEBUG: win7cuckoo: analysis still processing
2017-11-23 21:27:54,491 [cuckoo.core.guest] DEBUG: win7cuckoo: analysis still processing
2017-11-23 21:27:55,498 [cuckoo.core.guest] DEBUG: win7cuckoo: analysis still processing
2017-11-23 21:27:56,504 [cuckoo.core.guest] DEBUG: win7cuckoo: analysis still processing
2017-11-23 21:27:57,512 [cuckoo.core.guest] DEBUG: win7cuckoo: analysis still processing
2017-11-23 21:27:58,518 [cuckoo.core.guest] DEBUG: win7cuckoo: analysis still processing
2017-11-23 21:27:59,525 [cuckoo.core.guest] DEBUG: win7cuckoo: analysis still processing
2017-11-23 21:28:00,532 [cuckoo.core.guest] DEBUG: win7cuckoo: analysis still processing
2017-11-23 21:28:01,539 [cuckoo.core.guest] DEBUG: win7cuckoo: analysis still processing
2017-11-23 21:28:02,546 [cuckoo.core.guest] DEBUG: win7cuckoo: analysis still processing
2017-11-23 21:28:03,552 [cuckoo.core.guest] DEBUG: win7cuckoo: analysis still processing
2017-11-23 21:28:04,558 [cuckoo.core.guest] DEBUG: win7cuckoo: analysis still processing
2017-11-23 21:28:05,564 [cuckoo.core.guest] DEBUG: win7cuckoo: analysis still processing
2017-11-23 21:28:06,573 [cuckoo.core.guest] DEBUG: win7cuckoo: analysis still processing
2017-11-23 21:28:07,580 [cuckoo.core.guest] DEBUG: win7cuckoo: analysis still processing
2017-11-23 21:28:08,585 [cuckoo.core.guest] DEBUG: win7cuckoo: analysis still processing
2017-11-23 21:28:09,592 [cuckoo.core.guest] DEBUG: win7cuckoo: analysis still processing
2017-11-23 21:28:10,598 [cuckoo.core.guest] DEBUG: win7cuckoo: analysis still processing
2017-11-23 21:28:11,642 [cuckoo.core.guest] DEBUG: win7cuckoo: analysis still processing
2017-11-23 21:28:12,650 [cuckoo.core.guest] DEBUG: win7cuckoo: analysis still processing
2017-11-23 21:28:13,658 [cuckoo.core.guest] DEBUG: win7cuckoo: analysis still processing
2017-11-23 21:28:14,668 [cuckoo.core.guest] DEBUG: win7cuckoo: analysis still processing
2017-11-23 21:28:15,676 [cuckoo.core.guest] DEBUG: win7cuckoo: analysis still processing
2017-11-23 21:28:16,685 [cuckoo.core.guest] DEBUG: win7cuckoo: analysis still processing
2017-11-23 21:28:17,693 [cuckoo.core.guest] DEBUG: win7cuckoo: analysis still processing
2017-11-23 21:28:18,704 [cuckoo.core.guest] DEBUG: win7cuckoo: analysis still processing
2017-11-23 21:28:19,711 [cuckoo.core.guest] DEBUG: win7cuckoo: analysis still processing
2017-11-23 21:28:20,722 [cuckoo.core.guest] DEBUG: win7cuckoo: analysis still processing
2017-11-23 21:28:21,729 [cuckoo.core.guest] DEBUG: win7cuckoo: analysis still processing
2017-11-23 21:28:22,737 [cuckoo.core.guest] DEBUG: win7cuckoo: analysis still processing
2017-11-23 21:28:23,746 [cuckoo.core.guest] DEBUG: win7cuckoo: analysis still processing
2017-11-23 21:28:24,752 [cuckoo.core.guest] DEBUG: win7cuckoo: analysis still processing
2017-11-23 21:28:25,761 [cuckoo.core.guest] DEBUG: win7cuckoo: analysis still processing
2017-11-23 21:28:26,771 [cuckoo.core.guest] DEBUG: win7cuckoo: analysis still processing
2017-11-23 21:28:27,777 [cuckoo.core.guest] DEBUG: win7cuckoo: analysis still processing
2017-11-23 21:28:28,786 [cuckoo.core.guest] DEBUG: win7cuckoo: analysis still processing
2017-11-23 21:28:29,793 [cuckoo.core.guest] DEBUG: win7cuckoo: analysis still processing
2017-11-23 21:28:30,803 [cuckoo.core.guest] DEBUG: win7cuckoo: analysis still processing
2017-11-23 21:28:31,814 [cuckoo.core.guest] DEBUG: win7cuckoo: analysis still processing
2017-11-23 21:28:32,821 [cuckoo.core.guest] DEBUG: win7cuckoo: analysis still processing
2017-11-23 21:28:33,830 [cuckoo.core.guest] DEBUG: win7cuckoo: analysis still processing
2017-11-23 21:28:34,840 [cuckoo.core.guest] DEBUG: win7cuckoo: analysis still processing
2017-11-23 21:28:35,847 [cuckoo.core.guest] DEBUG: win7cuckoo: analysis still processing
2017-11-23 21:28:36,856 [cuckoo.core.guest] DEBUG: win7cuckoo: analysis still processing
2017-11-23 21:28:37,862 [cuckoo.core.guest] DEBUG: win7cuckoo: analysis still processing
2017-11-23 21:28:38,869 [cuckoo.core.guest] DEBUG: win7cuckoo: analysis still processing
2017-11-23 21:28:39,876 [cuckoo.core.guest] DEBUG: win7cuckoo: analysis still processing
2017-11-23 21:28:40,882 [cuckoo.core.guest] DEBUG: win7cuckoo: analysis still processing
2017-11-23 21:28:41,889 [cuckoo.core.guest] DEBUG: win7cuckoo: analysis still processing
2017-11-23 21:28:42,896 [cuckoo.core.guest] DEBUG: win7cuckoo: analysis still processing
2017-11-23 21:28:43,903 [cuckoo.core.guest] DEBUG: win7cuckoo: analysis still processing
2017-11-23 21:28:44,908 [cuckoo.core.guest] DEBUG: win7cuckoo: analysis still processing
2017-11-23 21:28:45,915 [cuckoo.core.guest] DEBUG: win7cuckoo: analysis still processing
2017-11-23 21:28:46,922 [cuckoo.core.guest] DEBUG: win7cuckoo: analysis still processing
2017-11-23 21:28:47,928 [cuckoo.core.guest] DEBUG: win7cuckoo: analysis still processing
2017-11-23 21:28:48,934 [cuckoo.core.guest] DEBUG: win7cuckoo: analysis still processing
2017-11-23 21:28:49,940 [cuckoo.core.guest] DEBUG: win7cuckoo: analysis still processing
2017-11-23 21:28:50,946 [cuckoo.core.guest] DEBUG: win7cuckoo: analysis still processing
2017-11-23 21:28:51,954 [cuckoo.core.guest] DEBUG: win7cuckoo: analysis still processing
2017-11-23 21:28:52,960 [cuckoo.core.guest] DEBUG: win7cuckoo: analysis still processing
2017-11-23 21:28:53,968 [cuckoo.core.guest] DEBUG: win7cuckoo: analysis still processing
2017-11-23 21:28:54,974 [cuckoo.core.guest] DEBUG: win7cuckoo: analysis still processing
2017-11-23 21:28:55,980 [cuckoo.core.guest] DEBUG: win7cuckoo: analysis still processing
2017-11-23 21:28:56,987 [cuckoo.core.guest] DEBUG: win7cuckoo: analysis still processing
2017-11-23 21:28:57,995 [cuckoo.core.guest] DEBUG: win7cuckoo: analysis still processing
2017-11-23 21:28:59,000 [cuckoo.core.guest] DEBUG: win7cuckoo: analysis still processing
2017-11-23 21:29:00,009 [cuckoo.core.guest] DEBUG: win7cuckoo: analysis still processing
2017-11-23 21:29:01,017 [cuckoo.core.guest] DEBUG: win7cuckoo: analysis still processing
2017-11-23 21:29:02,022 [cuckoo.core.guest] DEBUG: win7cuckoo: analysis still processing
2017-11-23 21:29:03,029 [cuckoo.core.guest] DEBUG: win7cuckoo: analysis still processing
2017-11-23 21:29:04,035 [cuckoo.core.guest] DEBUG: win7cuckoo: analysis still processing
2017-11-23 21:29:05,043 [cuckoo.core.guest] DEBUG: win7cuckoo: analysis still processing
2017-11-23 21:29:06,049 [cuckoo.core.guest] DEBUG: win7cuckoo: analysis still processing
2017-11-23 21:29:07,057 [cuckoo.core.guest] DEBUG: win7cuckoo: analysis still processing
2017-11-23 21:29:08,065 [cuckoo.core.guest] DEBUG: win7cuckoo: analysis still processing
2017-11-23 21:29:09,072 [cuckoo.core.guest] DEBUG: win7cuckoo: analysis still processing
2017-11-23 21:29:10,077 [cuckoo.core.guest] DEBUG: win7cuckoo: analysis still processing
2017-11-23 21:29:11,084 [cuckoo.core.guest] DEBUG: win7cuckoo: analysis still processing
2017-11-23 21:29:12,092 [cuckoo.core.guest] DEBUG: win7cuckoo: analysis still processing
2017-11-23 21:29:13,099 [cuckoo.core.guest] DEBUG: win7cuckoo: analysis still processing
2017-11-23 21:29:14,105 [cuckoo.core.guest] DEBUG: win7cuckoo: analysis still processing
2017-11-23 21:29:15,112 [cuckoo.core.guest] DEBUG: win7cuckoo: analysis still processing
2017-11-23 21:29:16,117 [cuckoo.core.guest] DEBUG: win7cuckoo: analysis still processing
2017-11-23 21:29:17,124 [cuckoo.core.guest] DEBUG: win7cuckoo: analysis still processing
2017-11-23 21:29:18,150 [cuckoo.core.guest] DEBUG: win7cuckoo: analysis still processing
2017-11-23 21:29:19,156 [cuckoo.core.guest] DEBUG: win7cuckoo: analysis still processing
2017-11-23 21:29:20,162 [cuckoo.core.guest] DEBUG: win7cuckoo: analysis still processing
2017-11-23 21:29:21,171 [cuckoo.core.guest] DEBUG: win7cuckoo: analysis still processing
2017-11-23 21:29:22,176 [cuckoo.core.guest] DEBUG: win7cuckoo: analysis still processing
2017-11-23 21:29:23,181 [cuckoo.core.guest] DEBUG: win7cuckoo: analysis still processing
2017-11-23 21:29:24,190 [cuckoo.core.guest] DEBUG: win7cuckoo: analysis still processing
2017-11-23 21:29:25,197 [cuckoo.core.guest] DEBUG: win7cuckoo: analysis still processing
2017-11-23 21:29:26,208 [cuckoo.core.guest] DEBUG: win7cuckoo: analysis still processing
2017-11-23 21:29:27,213 [cuckoo.core.guest] DEBUG: win7cuckoo: analysis still processing
2017-11-23 21:29:28,223 [cuckoo.core.guest] DEBUG: win7cuckoo: analysis still processing
2017-11-23 21:29:29,230 [cuckoo.core.guest] DEBUG: win7cuckoo: analysis still processing
2017-11-23 21:29:30,238 [cuckoo.core.guest] DEBUG: win7cuckoo: analysis still processing
2017-11-23 21:29:31,246 [cuckoo.core.guest] DEBUG: win7cuckoo: analysis still processing
2017-11-23 21:29:32,253 [cuckoo.core.guest] DEBUG: win7cuckoo: analysis still processing
2017-11-23 21:29:33,259 [cuckoo.core.guest] DEBUG: win7cuckoo: analysis still processing
2017-11-23 21:29:34,265 [cuckoo.core.guest] DEBUG: win7cuckoo: analysis still processing
2017-11-23 21:29:35,274 [cuckoo.core.guest] DEBUG: win7cuckoo: analysis still processing
2017-11-23 21:29:36,280 [cuckoo.core.guest] DEBUG: win7cuckoo: analysis still processing
2017-11-23 21:29:37,287 [cuckoo.core.guest] DEBUG: win7cuckoo: analysis still processing
2017-11-23 21:29:38,293 [cuckoo.core.guest] DEBUG: win7cuckoo: analysis still processing
2017-11-23 21:29:39,299 [cuckoo.core.guest] DEBUG: win7cuckoo: analysis still processing
2017-11-23 21:29:40,305 [cuckoo.core.guest] DEBUG: win7cuckoo: analysis still processing
2017-11-23 21:29:41,313 [cuckoo.core.guest] DEBUG: win7cuckoo: analysis still processing
2017-11-23 21:29:42,321 [cuckoo.core.guest] DEBUG: win7cuckoo: analysis still processing
2017-11-23 21:29:43,326 [cuckoo.core.guest] DEBUG: win7cuckoo: analysis still processing
2017-11-23 21:29:44,332 [cuckoo.core.guest] DEBUG: win7cuckoo: analysis still processing
2017-11-23 21:29:45,340 [cuckoo.core.guest] DEBUG: win7cuckoo: analysis still processing
2017-11-23 21:29:46,347 [cuckoo.core.guest] DEBUG: win7cuckoo: analysis still processing
2017-11-23 21:29:47,354 [cuckoo.core.guest] DEBUG: win7cuckoo: analysis still processing
2017-11-23 21:29:48,360 [cuckoo.core.guest] DEBUG: win7cuckoo: analysis still processing
2017-11-23 21:29:49,367 [cuckoo.core.guest] DEBUG: win7cuckoo: analysis still processing
2017-11-23 21:29:50,373 [cuckoo.core.guest] DEBUG: win7cuckoo: analysis still processing
2017-11-23 21:29:51,380 [cuckoo.core.guest] DEBUG: win7cuckoo: analysis still processing
2017-11-23 21:29:52,386 [cuckoo.core.guest] DEBUG: win7cuckoo: analysis still processing
2017-11-23 21:29:53,393 [cuckoo.core.guest] DEBUG: win7cuckoo: analysis still processing
2017-11-23 21:29:54,399 [cuckoo.core.guest] DEBUG: win7cuckoo: analysis still processing
2017-11-23 21:29:55,409 [cuckoo.core.guest] DEBUG: win7cuckoo: analysis still processing
2017-11-23 21:29:56,415 [cuckoo.core.guest] DEBUG: win7cuckoo: analysis still processing
2017-11-23 21:29:57,425 [cuckoo.core.guest] DEBUG: win7cuckoo: analysis still processing
2017-11-23 21:29:58,437 [cuckoo.core.guest] DEBUG: win7cuckoo: analysis still processing
2017-11-23 21:29:59,447 [cuckoo.core.guest] DEBUG: win7cuckoo: analysis still processing
2017-11-23 21:30:00,457 [cuckoo.core.guest] DEBUG: win7cuckoo: analysis still processing
2017-11-23 21:30:01,470 [cuckoo.core.guest] DEBUG: win7cuckoo: analysis still processing
2017-11-23 21:30:02,481 [cuckoo.core.guest] DEBUG: win7cuckoo: analysis still processing
2017-11-23 21:30:03,488 [cuckoo.core.guest] DEBUG: win7cuckoo: analysis still processing
2017-11-23 21:30:04,497 [cuckoo.core.guest] DEBUG: win7cuckoo: analysis still processing
2017-11-23 21:30:05,506 [cuckoo.core.guest] DEBUG: win7cuckoo: analysis still processing
2017-11-23 21:30:06,514 [cuckoo.core.guest] DEBUG: win7cuckoo: analysis still processing
2017-11-23 21:30:07,525 [cuckoo.core.guest] DEBUG: win7cuckoo: analysis still processing
2017-11-23 21:30:08,533 [cuckoo.core.guest] DEBUG: win7cuckoo: analysis still processing
2017-11-23 21:30:09,539 [cuckoo.core.guest] DEBUG: win7cuckoo: analysis still processing
2017-11-23 21:30:10,545 [cuckoo.core.guest] DEBUG: win7cuckoo: analysis still processing
2017-11-23 21:30:11,546 [cuckoo.core.guest] INFO: win7cuckoo: end of analysis reached!
2017-11-23 21:30:11,558 [cuckoo.core.plugins] DEBUG: Stopped auxiliary module: Sniffer
2017-11-23 21:30:11,558 [cuckoo.machinery.virtualbox] DEBUG: Stopping vm win7cuckoo
2017-11-23 21:30:12,782 [cuckoo.core.scheduler] DEBUG: Released database task #1
2017-11-23 21:30:12,813 [cuckoo.core.plugins] DEBUG: Executed processing module "AnalysisInfo" for task #1
2017-11-23 21:30:12,813 [cuckoo.processing.behavior] WARNING: Analysis results folder does not exist at path '/home/cuckoo/.cuckoo/storage/analyses/1/logs'.
2017-11-23 21:30:12,816 [cuckoo.core.plugins] DEBUG: Executed processing module "BehaviorAnalysis" for task #1
2017-11-23 21:30:12,817 [cuckoo.core.plugins] DEBUG: Executed processing module "Dropped" for task #1
2017-11-23 21:30:12,817 [cuckoo.core.plugins] DEBUG: Executed processing module "DroppedBuffer" for task #1
2017-11-23 21:30:12,817 [cuckoo.core.plugins] DEBUG: Executed processing module "Extracted" for task #1
2017-11-23 21:30:12,818 [cuckoo.core.plugins] DEBUG: Executed processing module "MetaInfo" for task #1
2017-11-23 21:30:12,819 [cuckoo.core.plugins] DEBUG: Executed processing module "ProcessMemory" for task #1
2017-11-23 21:30:12,819 [cuckoo.core.plugins] DEBUG: Executed processing module "Procmon" for task #1
2017-11-23 21:30:12,823 [cuckoo.core.plugins] DEBUG: Executed processing module "Screenshots" for task #1
2017-11-23 21:30:12,947 [cuckoo.core.plugins] DEBUG: Executed processing module "Static" for task #1
2017-11-23 21:30:12,958 [cuckoo.core.plugins] DEBUG: Executed processing module "Strings" for task #1
2017-11-23 21:30:12,968 [cuckoo.core.plugins] DEBUG: Executed processing module "TargetInfo" for task #1
2017-11-23 21:30:13,135 [cuckoo.core.plugins] DEBUG: Executed processing module "NetworkAnalysis" for task #1
2017-11-23 21:30:13,135 [cuckoo.core.plugins] DEBUG: Executed processing module "TLSMasterSecrets" for task #1
2017-11-23 21:30:13,140 [cuckoo.processing.debug] ERROR: Error processing task #1: it appears that the Virtual Machine hasn't been able to contact back to the Cuckoo Host. There could be a few reasons for this, please refer to our documentation on the matter: https://cuckoo.sh/docs/faq/index.html#troubleshooting-vm-network-configuration
2017-11-23 21:30:13,154 [cuckoo.core.plugins] DEBUG: Executed processing module "Debug" for task #1
2017-11-23 21:30:13,163 [cuckoo.core.plugins] DEBUG: Running 472 signatures
2017-11-23 21:30:13,417 [cuckoo.core.plugins] DEBUG: Executed reporting module "JsonDump"
2017-11-23 21:30:14,395 [cuckoo.core.plugins] DEBUG: Executed reporting module "SingleFile"
2017-11-23 21:30:14,443 [cuckoo.core.plugins] DEBUG: Executed reporting module "MongoDB"
2017-11-23 21:30:14,443 [cuckoo.core.scheduler] INFO: Task #1: reports generation completed
2017-11-23 21:30:14,491 [cuckoo.core.scheduler] INFO: Task #1: analysis procedure completed

**[cuckoo]**
# Enable or disable startup version check. When enabled, Cuckoo will connect
# to a remote location to verify whether the running version is the latest
# one available.
version_check = yes

machinery = virtualbox
process_results = yes
rooter = /tmp/cuckoo-rooter

[resultserver]

# `resultserver_ip` for all your virtual machines in machinery configuration.
ip = 192.168.56.1

# Specify a port number to bind the result server on.
port = 2042

process_results = yes
rooter = /tmp/cuckoo-rooter

**[virtualbox]**
# Specify which VirtualBox mode you want to run your machines on.
# Can be "gui" or "headless". Please refer to VirtualBox's official
# documentation to understand the differences.
mode = headless

# Path to the local installation of the VBoxManage utility.
path = /usr/bin/VBoxManage
interface = vboxnet0
machines = win7cuckoo

[win7cuckoo]
# Specify the label name of the current machine as specified in your
# VirtualBox configuration.
label = win7cuckoo

# Specify the operating system platform used by current machine
# [windows/darwin/linux].
platform = windows

# Specify the IP address of the current virtual machine. Make sure that the
# IP address is valid and that the host machine is able to reach it. If not,
# the analysis will fail.
ip = 192.168.56.10

snapshot = snapshot2

# (Optional) Specify the name of the network interface that should be used
# when dumping network traffic from this machine with tcpdump. If specified,
# overrides the default interface specified in auxiliary.conf
# Example (vboxnet0 is the interface name):
interface = vboxnet0

resultserver_ip = 0.0.0.0 # have alternate resultserver here and leave blank in cuckoo.con same result.
# (Optional) Specify the port for the Result Server, as your virtual machine se$
# The Result Server will always bind to the address and port specified in cucko$
# however you could set up your virtual network to use NAT/PAT, so you can spec$
# the port for the Result Server as your machine sees it. If you don't specify $
# here, the machine will use the default value from cuckoo.conf.
# Example:
resultserver_port = 2042

cuckoo@cuckoo-virtbox:~$ curl 192.168.56.10:8000
{"message": "Cuckoo Agent!", "version": "0.8", "features": ["execpy", "pinning", "logs", "largefile", "unicodepath"]}cuckoo@cuckoo-virtbox:~$ I have also tried the legacy agent.py I got error 501 http get method not supported by the server. 
**IP Table output**
-P INPUT ACCEPT
-P FORWARD ACCEPT
-P OUTPUT ACCEPT
-A FORWARD -s 192.168.56.0/24 -i vboxnet0 -o eth0 -m conntrack --ctstate NEW -j ACCEPT
-A FORWARD -m conntrack --ctstate RELATED,ESTABLISHED -j ACCEPT
cuckoo@cuckoo-virtbox:~$ 
The windows 7 can access the Intener without proble.

**TCPDump output:**

16:46:51.756116 IP cuckoo-virtbox.42776 > 192.168.56.10.8000: Flags [S], seq 3537286614, win 29200, options [mss 1460,sackOK,TS val 1842134716 ecr 0,nop,wscale 7], length 0
16:46:52.759842 IP cuckoo-virtbox.42778 > 192.168.56.10.8000: Flags [S], seq 4164286314, win 29200, options [mss 1460,sackOK,TS val 1842135720 ecr 0,nop,wscale 7], length 0
16:46:53.764448 IP cuckoo-virtbox.42784 > 192.168.56.10.8000: Flags [S], seq 3599471284, win 29200, options [mss 1460,sackOK,TS val 1842136725 ecr 0,nop,wscale 7], length 0
16:46:54.767030 IP cuckoo-virtbox.42788 > 192.168.56.10.8000: Flags [S], seq 1013487972, win 29200, options [mss 1460,sackOK,TS val 1842137727 ecr 0,nop,wscale 7], length 0
16:46:55.770071 IP cuckoo-virtbox.42790 > 192.168.56.10.8000: Flags [S], seq 3589223106, win 29200, options [mss 1460,sackOK,TS val 1842138730 ecr 0,nop,wscale 7], length 0
16:46:55.770681 IP 192.168.56.10.8000 > cuckoo-virtbox.42790: Flags [S.], seq 852681418, ack 3589223107, win 8192, options [mss 1460,nop,wscale 8,sackOK,TS val 130742 ecr 1842138730], length 0
16:46:55.770700 IP cuckoo-virtbox.42790 > 192.168.56.10.8000: Flags [.], ack 1, win 229, options [nop,nop,TS val 1842138731 ecr 130742], length 0
16:46:55.772030 IP cuckoo-virtbox.42790 > 192.168.56.10.8000: Flags [F.], seq 1, ack 1, win 229, options [nop,nop,TS val 1842138732 ecr 130742], length 0
16:46:55.774895 IP cuckoo-virtbox.42792 > 192.168.56.10.8000: Flags [S], seq 1080137045, win 29200, options [mss 1460,sackOK,TS val 1842138735 ecr 0,nop,wscale 7], length 0
16:46:55.776826 IP 192.168.56.10.8000 > cuckoo-virtbox.42792: Flags [S.], seq 2288868306, ack 1080137046, win 8192, options [mss 1460,nop,wscale 8,sackOK,TS val 130743 ecr 1842138735], length 0
16:46:55.776870 IP cuckoo-virtbox.42792 > 192.168.56.10.8000: Flags [.], ack 1, win 229, options [nop,nop,TS val 1842138737 ecr 130743], length 0
16:46:55.776895 IP 192.168.56.10.8000 > cuckoo-virtbox.42790: Flags [.], ack 2, win 260, options [nop,nop,TS val 130743 ecr 1842138732], length 0
16:46:55.777493 IP 192.168.56.10.8000 > cuckoo-virtbox.42790: Flags [F.], seq 1, ack 2, win 260, options [nop,nop,TS val 130743 ecr 1842138732], length 0
16:46:55.777504 IP cuckoo-virtbox.42790 > 192.168.56.10.8000: Flags [.], ack 2, win 229, options [nop,nop,TS val 1842138738 ecr 130743], length 0
16:46:55.778144 IP cuckoo-virtbox.42792 > 192.168.56.10.8000: Flags [P.], seq 1:150, ack 1, win 229, options [nop,nop,TS val 1842138738 ecr 130743], length 149
16:46:55.779254 IP 192.168.56.10.8000 > cuckoo-virtbox.42792: Flags [P.], seq 1:18, ack 150, win 260, options [nop,nop,TS val 130743 ecr 1842138738], length 17

**ifconfig output.**

cuckoo@cuckoo-virtbox:~$ ifconfig
enp0s3: flags=4163<UP,BROADCAST,RUNNING,MULTICAST>  mtu 1500
        inet 10.0.2.15  netmask 255.255.255.0  broadcast 10.0.2.255
        inet6 fe80::a436:9943:9afd:5361  prefixlen 64  scopeid 0x20<link>
        ether 08:00:27:27:b0:33  txqueuelen 1000  (Ethernet)
        RX packets 28398  bytes 25882572 (25.8 MB)
        RX errors 0  dropped 0  overruns 0  frame 0
        TX packets 15012  bytes 2034544 (2.0 MB)
        TX errors 0  dropped 0 overruns 0  carrier 0  collisions 0

lo: flags=73<UP,LOOPBACK,RUNNING>  mtu 65536
        inet 127.0.0.1  netmask 255.0.0.0
        inet6 ::1  prefixlen 128  scopeid 0x10<host>
        loop  txqueuelen 1000  (Local Loopback)
        RX packets 12794  bytes 2793359 (2.7 MB)
        RX errors 0  dropped 0  overruns 0  frame 0
        TX packets 12794  bytes 2793359 (2.7 MB)
        TX errors 0  dropped 0 overruns 0  carrier 0  collisions 0

vboxnet0: flags=4163<UP,BROADCAST,RUNNING,MULTICAST>  mtu 1500
        inet 192.168.56.1  netmask 255.255.255.0  broadcast 192.168.56.255
        inet6 fe80::800:27ff:fe00:0  prefixlen 64  scopeid 0x20<link>
        ether 0a:00:27:00:00:00  txqueuelen 1000  (Ethernet)
        RX packets 0  bytes 0 (0.0 B)
        RX errors 0  dropped 0  overruns 0  frame 0
        TX packets 1335  bytes 345477 (345.4 KB)
        TX errors 0  dropped 0 overruns 0  carrier 0  collisions 0

Thank you in advance for your assistance. I appreciate your time.

**Comment by rehanalam1** [comment]
check if windows firewall and UAC and not enabled.

**Comment by jbremer** [comment]
What was mentioned above by @rehanalam1. Closing issue and please read our documentation thorough once again.
